{"schema_version":"1.0","experiment_id":"cs-ranking-binance-spot-archive-ptu-acquisition-v3","verdict":"REVISION_REQUIRED","source_commit":"ab4817f057de3ed2d082cee634aad73a56286047","draft_sha256":"144d795799304945e115b9006d54fc6490b31dc00c3c0e485094980bbab21c0e","scope":"Independent repository-only, read-only Phase 2 research-direction audit of the exact bound preregistration draft. All open_exactly paths were read. hash_without_opening paths were SHA-256 hashed only and were not printed, parsed, searched, or semantically inspected. No implementation, acquisition, market-data, holdout, return, training, backtest, profitability, credential, order, capital, GPU, or mining action was performed or authorized.","confirmed":["The worktree was clean before inspection and remained clean afterward; exact HEAD is ab4817f057de3ed2d082cee634aad73a56286047.","Authorization source_parent_commit b4f71a5533d38436fc8ce13fea8a974388af5fba is an ancestor of the audited HEAD. The Phase 2, route, and draft source-parent commits are also ancestors.","The authorization, prompt, timeout evidence, draft, output schema, route authorization, Phase 2 authorization, and v2 model result are tracked at the audited HEAD.","The draft byte SHA-256 is 437d87ceb355b030b8729fae2183547a939d7c10e41812f12e7c45e0cfefa1b6 and its recomputed canonical SHA-256 is exactly 144d795799304945e115b9006d54fc6490b31dc00c3c0e485094980bbab21c0e.","The bound prompt byte hash and bound attempt-2 timeout byte and canonical hashes match the authorization.","The Phase 2 authorization, route authorization, v2 model result, and all hash_without_opening byte hashes match their inspected bindings. The rejected v1 SYMBOL_MANIFEST.json was hash-checked only and never opened.","No embedded 2026 market-data identity, data/raw path, external market data, or holdout source was inspected."],"checks":[{"check":"0. Repository, source-parent, and authorization bindings","status":"FAIL","finding":"Repository cleanliness, exact HEAD, ancestry, prompt, timeout, and draft bindings pass. The bound output schema does not: authorization expects byte SHA-256 a9683091dcb09434d5c510294b29e7dccc9d2d0b7fd1d4b008df27bcfe5562f8 and canonical SHA-256 f77b845da9a1331023da5a12a29b33722594d33db040c957923bf4b4ce03c17e, while the tracked file recomputes to byte SHA-256 c92a4742bad1f1ad2a19d5a99d956a6f3dcbbf5f008217555fa9e91b35471bbd and canonical SHA-256 5e8154a7c91aa5de404b05fb3d4d59e0238dc2d4152ee86253c7d709fae387f1."},{"check":"1. Immutable prior verdicts and permanent v1-manifest ineligibility","status":"PASS","finding":"The draft preserves the Phase 1 result and the v1/v2 DATA_NO_GO or AUDIT_INCONCLUSIVE verdicts, makes the rejected v1 manifest permanently ineligible, forbids copying its observations, and prohibits rewriting or promoting prior evidence."},{"check":"2. Every v3 observation requires new retained official bytes","status":"PASS","finding":"prior_evidence_preservation.use_rule requires every v3 directory, symbol, month, object, checksum, row, boundary, and eligibility observation to derive from newly retained official response bytes; prior artifacts are limited to contaminated history, fixtures, requirements, and multiplicity evidence."},{"check":"3. Raw XML binds CommonPrefixes, pagination, and ObjectRecords","status":"PASS","finding":"Raw listing responses are content-addressed and indexed; decoded records retain the raw-response hash, request identity, pagination fields, ordered CommonPrefixes, ordered ObjectRecords, and a self-excluding canonical hash. The reconstruction and pass gates require re-decoding raw XML and reproducing the bindings."},{"check":"4. Root and 101 month queries exclude 2026 and full-symbol listings","status":"PASS","finding":"The root request is restricted to the exact delimiter-based directory query and rejects nested Contents. Each symbol is scheduled for exactly 101 exact month-prefix queries from 2017-08 through 2025-12; full-symbol listing, later-month listing, synthesized keys, and holdout identity resolution are prohibited."},{"check":"5. Metadata, object bytes, checksums, hashes, and timestamps cross-bind","status":"FAIL","finding":"The retained schemas and artifact invariants substantially cross-bind listing metadata, downloads, checksum bytes, calculated hashes, and retrieval timestamps. However, redirects are constrained by final scheme and host without explicitly requiring the final path and query to preserve the original exact listing request or listed object key. A same-host redirect to a different allowlisted development identity is therefore not expressly rejected."},{"check":"6. ZIP and exact CSV/OHLCV validation are executable","status":"FAIL","finding":"ZIP member identity, traversal, encryption, symlink, size, compression ratio, CRC, timestamp-unit, Decimal, and OHLCV rules are strong. The CSV acceptance boundary is not fully frozen: encoding error handling, BOM policy for CSV, dialect and quoting parameters, line-ending and blank-record handling, Decimal lexical grammar, and validation of the ignore field are unspecified and can yield implementation-dependent classifications."},{"check":"7. Duplicates, revisions, gaps, malformed data, and count arithmetic fail closed","status":"FAIL","finding":"Rows, gaps, malformed months, revision conflicts, and conflicting key metadata fail closed. An identical duplicate ObjectRecord key is not explicitly rejected because the reject clause names only conflicting duplicate keys or metadata. Count invariants also use undefined quantities such as listed objects, missing downloads, and quarantined complete pairs without an exhaustive declared state partition for every scheduled month slot and complete pair."},{"check":"8. Raw-only reconstruction and resume identities close the v2 production-path failure","status":"FAIL","finding":"The required production entry point, raw-only independent rebuild, byte-identical canonical outputs, and representative reconciliation address the v2 path failure. Resume identity remains underspecified: the canonical request-identity tuple and serialization are not defined, and prior_request_id cannot distinguish retry attempts when retries share one logical request_id."},{"check":"9. Symbol reuse, rename/migration, gaps, episode splitting, and fresh recovery","status":"FAIL","finding":"Gap splitting, no cross-gap carry, no name-similarity merge, and fresh 30-bar recovery are conservative. The optional rename/migration notice mechanism is not executable under the frozen transport: no notice source, query schedule, request kind, parser, retention schema, or budget is authorized. It is also unclear whether IDENTITY_UNRESOLVED applies to every symbol-label episode or only a preidentified subset, which can make eligibility either vacuous or selectively determined."},{"check":"10. Membership and liquidity use only completed pre-signal rows","status":"PASS","finding":"Membership and the 30-bar quote-volume score use only verified rows with close_time strictly earlier than the signal, with deterministic symbol-byte and episode-id ties. Current or future liquidity and metadata are forbidden."},{"check":"11. Retrospective last-bar knowledge cannot remove earlier membership","status":"PASS","finding":"The retrospective last-observed field is audit-only metadata and cannot impose survival, pre-delisting exclusion, or earlier removal. Later gaps, availability, revisions, and manifest boundaries are forbidden membership inputs."},{"check":"12. Delisting, next-bar, delay, terminal, and synchronization never forward-scan","status":"PASS","finding":"Base execution requires the exact row at S; delay requires exactly S plus one day; missing rows, partial baskets, asynchronous rows, quarantines, and terminal boundaries produce no fill. Forward scanning and favorable delisting exits are prohibited."},{"check":"13. Archive completeness and asset identity are not overstated","status":"PASS","finding":"The claim is explicitly a retrieval snapshot rather than formal historical or exchange-wide completeness. The draft disclaims deleted or revised historical objects and limits directory strings to observed pair labels rather than asset, contract, legal-entity, or current-tradability identity."},{"check":"14. Ex-ante sufficiency gates support a later cross-sectional baseline","status":"PASS","finding":"The frozen gates require at least 25 distinct exact symbols with independently verified 365-row episodes and at least 365 development signal days with 25 causally eligible episodes, plus full provenance, reconstruction, causal, resource, and audit passes. These thresholds are ex ante and materially relevant to a later baseline."},{"check":"15. Requests, resources, retries, repairs, audits, and failure precedence are bounded and non-economic","status":"PASS","finding":"The draft fixes concurrency, timeouts, retry conditions and delays, total attempts, response and store bytes, free-space gates, cycles, per-cycle work, memory, repair budgets, and audit attempts. Timeout, infrastructure, implementation, and data failures are separated from economic conclusions, with safety and holdout failures taking precedence."},{"check":"16. DATA_CONTRACT_GO has narrow non-economic scope","status":"PASS","finding":"DATA_CONTRACT_GO permits only a separately preregistered baseline using eligible v3 episodes. It cannot validate returns, profitability, model quality, promotion, holdout access, trading, credentials, orders, leverage, capital, GPU, mining, or autonomous financial action."}],"required_revisions":[{"severity":"major","clause":"DIRECTION_REVIEW_ATTEMPT_3_AUTHORIZATION.json.output_schema","problem":"The tracked output schema fails both authorized byte and canonical hashes, so the attempt's output contract is not the artifact bound by its authorization.","exact_required_change":"Before freeze, either restore DIRECTION_REVIEW_OUTPUT_SCHEMA.json to the exact authorized byte and canonical identities or obtain a new e